{
  "refreshedAt": "2026-10-23",
  "exportedAt": "2026-10-23T14:50:51+00:00",
  "source": "03_Team_Enablement/daily_tracker.xlsx · Sprint Metrics + Quality Intake Detail",
  "sprints": [
    {
      "sprintId": 4697,
      "name": "Sprint 4697",
      "windowStart": "2026-09-09",
      "windowEnd": "2026-09-21",
      "weekdays": 9,
      "partial": false,
      "counts": {
        "pswat": 3,
        "appBugs": 19
      },
      "ratesPer10Weekdays": {
        "pswat": 3.33,
        "appBugs": 21.11
      },
      "tickets": [
        {
          "source": "APP Bugs",
          "key": "APP-2902",
          "summary": "custom idle timeout not working",
          "type": "Bug",
          "status": "Done",
          "created": "2026-09-09",
          "url": "https://mysnaplogic.atlassian.net/browse/APP-2902"
        },
        {
          "source": "APP Bugs",
          "key": "APP-2912",
          "summary": "Investigate incorrect behavior during Alerting tests",
          "type": "Bug",
          "status": "Open",
          "created": "2026-09-10",
          "url": "https://mysnaplogic.atlassian.net/browse/APP-2912"
        },
        {
          "source": "APP Bugs",
          "key": "APP-2913",
          "summary": "[Data Lineage] Lineage in ternary condition is not tracked",
          "type": "Bug",
          "status": "Open",
          "created": "2026-09-11",
          "url": "https://mysnaplogic.atlassian.net/browse/APP-2913"
        },
        {
          "source": "APP Bugs",
          "key": "APP-2916",
          "summary": "The OpenLineage API is returning an HTTP 500 Internal Server Error when requesting page 7 of the lineage results.",
          "type": "Bug",
          "status": "Done",
          "created": "2026-09-14",
          "url": "https://mysnaplogic.atlassian.net/browse/APP-2916"
        },
        {
          "source": "APP Bugs",
          "key": "APP-2927",
          "summary": "Snaplex icon in the toolbar is unclickable while a long-running pipeline is executing",
          "type": "Bug",
          "status": "Done",
          "created": "2026-09-15",
          "url": "https://mysnaplogic.atlassian.net/browse/APP-2927"
        },
        {
          "source": "APP Bugs",
          "key": "APP-2928",
          "summary": "Deprecated Snaplex version alerts are not seen in the Monitor",
          "type": "Bug",
          "status": "Done",
          "created": "2026-09-15",
          "url": "https://mysnaplogic.atlassian.net/browse/APP-2928"
        },
        {
          "source": "APP Bugs",
          "key": "APP-2936",
          "summary": "Enable and migrate formEngine test suites",
          "type": "Bug",
          "status": "Done",
          "created": "2026-09-16",
          "url": "https://mysnaplogic.atlassian.net/browse/APP-2936"
        },
        {
          "source": "APP Bugs",
          "key": "APP-2937",
          "summary": "Fix onClickAcceptSelcted typo",
          "type": "Bug",
          "status": "Done",
          "created": "2026-09-16",
          "url": "https://mysnaplogic.atlassian.net/browse/APP-2937"
        },
        {
          "source": "APP Bugs",
          "key": "APP-2938",
          "summary": "Run the Designer tests in CI, and fix the failures blocking that",
          "type": "Bug",
          "status": "Done",
          "created": "2026-09-16",
          "url": "https://mysnaplogic.atlassian.net/browse/APP-2938"
        },
        {
          "source": "APP Bugs",
          "key": "APP-2939",
          "summary": "[UI] - Error\" Failed health/status check. Git server hostname misconfigured: https://dev.azure.com/woundedwarriorproject \"",
          "type": "Bug",
          "status": "Done",
          "created": "2026-09-16",
          "url": "https://mysnaplogic.atlassian.net/browse/APP-2939"
        },
        {
          "source": "APP Bugs",
          "key": "APP-2941",
          "summary": "Lint FormEngine",
          "type": "Bug",
          "status": "Done",
          "created": "2026-09-16",
          "url": "https://mysnaplogic.atlassian.net/browse/APP-2941"
        },
        {
          "source": "APP Bugs",
          "key": "APP-2943",
          "summary": "Fix url precedence issue in sldb manager factory",
          "type": "Bug",
          "status": "Open",
          "created": "2026-09-16",
          "url": "https://mysnaplogic.atlassian.net/browse/APP-2943"
        },
        {
          "source": "APP Bugs",
          "key": "APP-2965",
          "summary": "Investigate ACL behavior when unsubscribe the AutoSync feature",
          "type": "Bug",
          "status": "Open",
          "created": "2026-09-17",
          "url": "https://mysnaplogic.atlassian.net/browse/APP-2965"
        },
        {
          "source": "APP Bugs",
          "key": "APP-2971",
          "summary": "Some buttons broken in Admin manager page",
          "type": "Bug",
          "status": "Done",
          "created": "2026-09-18",
          "url": "https://mysnaplogic.atlassian.net/browse/APP-2971"
        },
        {
          "source": "APP Bugs",
          "key": "APP-2972",
          "summary": "Doc links for Import and Export Project to be updated",
          "type": "Bug",
          "status": "Done",
          "created": "2026-09-20",
          "url": "https://mysnaplogic.atlassian.net/browse/APP-2972"
        },
        {
          "source": "APP Bugs",
          "key": "APP-2975",
          "summary": "Pipeline does not show the \"=\" token in expression library",
          "type": "Bug",
          "status": "Open",
          "created": "2026-09-21",
          "url": "https://mysnaplogic.atlassian.net/browse/APP-2975"
        },
        {
          "source": "APP Bugs",
          "key": "APP-2976",
          "summary": "[Designer] Moved pipeline still shows old path in tab tooltip",
          "type": "Bug",
          "status": "Open",
          "created": "2026-09-21",
          "url": "https://mysnaplogic.atlassian.net/browse/APP-2976"
        },
        {
          "source": "APP Bugs",
          "key": "APP-2977",
          "summary": "[Designer] Cannot move pipeline",
          "type": "Bug",
          "status": "Open",
          "created": "2026-09-21",
          "url": "https://mysnaplogic.atlassian.net/browse/APP-2977"
        },
        {
          "source": "APP Bugs",
          "key": "APP-3033",
          "summary": "In Monitor, user is unable to navigate back to original org",
          "type": "Bug",
          "status": "In Review",
          "created": "2026-09-10",
          "url": "https://mysnaplogic.atlassian.net/browse/APP-3033"
        },
        {
          "source": "PSWAT",
          "key": "PSWAT-2730",
          "summary": "[SnapGPT] Org admin cannot configure SnapGPT.",
          "type": "Bug",
          "status": "Integration Testing",
          "created": "2026-09-17",
          "url": "https://mysnaplogic.atlassian.net/browse/PSWAT-2730"
        },
        {
          "source": "PSWAT",
          "key": "PSWAT-2732",
          "summary": "HTTP 429 error on Sharepoint Online snap",
          "type": "Bug",
          "status": "Open",
          "created": "2026-09-11",
          "url": "https://mysnaplogic.atlassian.net/browse/PSWAT-2732"
        },
        {
          "source": "PSWAT",
          "key": "PSWAT-2733",
          "summary": "RuntimeLogWrite logs are no longer present in jcc.json",
          "type": "Bug",
          "status": "Resolved",
          "created": "2026-09-21",
          "url": "https://mysnaplogic.atlassian.net/browse/PSWAT-2733"
        }
      ]
    },
    {
      "sprintId": 12119,
      "name": "APP Sprint 10-09-2026",
      "windowStart": "2026-09-22",
      "windowEnd": "2026-10-11",
      "weekdays": 14,
      "partial": false,
      "counts": {
        "pswat": 2,
        "appBugs": 31
      },
      "ratesPer10Weekdays": {
        "pswat": 1.43,
        "appBugs": 22.14
      },
      "tickets": [
        {
          "source": "APP Bugs",
          "key": "APP-3005",
          "summary": "Remove unused test script",
          "type": "Bug",
          "status": "Open",
          "created": "2026-09-22",
          "url": "https://mysnaplogic.atlassian.net/browse/APP-3005"
        },
        {
          "source": "APP Bugs",
          "key": "APP-3006",
          "summary": "App Settings and RunTime Arrchive Doc Link is broken",
          "type": "Bug",
          "status": "Done",
          "created": "2026-09-22",
          "url": "https://mysnaplogic.atlassian.net/browse/APP-3006"
        },
        {
          "source": "APP Bugs",
          "key": "APP-3031",
          "summary": "Investigate CC alert and snaplex metrics during test",
          "type": "Bug",
          "status": "Open",
          "created": "2026-09-23",
          "url": "https://mysnaplogic.atlassian.net/browse/APP-3031"
        },
        {
          "source": "APP Bugs",
          "key": "APP-3037",
          "summary": "Admin Manager: Env Admin cannot update a multi-org user's profile — save fails with cross-org \"cannot change authentication methods\" error",
          "type": "Bug",
          "status": "Open",
          "created": "2026-09-24",
          "url": "https://mysnaplogic.atlassian.net/browse/APP-3037"
        },
        {
          "source": "APP Bugs",
          "key": "APP-3038",
          "summary": "UI fetches all assets in a folder — asset-listing requests are missing asset-type filters",
          "type": "Bug",
          "status": "Open",
          "created": "2026-09-24",
          "url": "https://mysnaplogic.atlassian.net/browse/APP-3038"
        },
        {
          "source": "APP Bugs",
          "key": "APP-3040",
          "summary": "APP-1135 fix disables ultra alias conflict check for overwrite import, letting duplicate aliases in that then cannot be deleted",
          "type": "Bug",
          "status": "Open",
          "created": "2026-09-24",